
<!-- DTD pour le fichier des langues  -->

<!ELEMENT LANGUES (RECORD+)>

<!ELEMENT RECORD (THESAURUS_ID, DESCRIPTEUR_ID, TOPTERM)>

<!ELEMENT LIBELLE	(#PCDATA)>

<!ELEMENT COURTE	(#PCDATA)>

<!ELEMENT TRI		(#PCDATA)>

<!ATTLIST LANGUES

			VERSION	CDATA		#REQUIRED >
